{
  "manager_id": "mgr_1",
  "season_id": "2025-26",
  "gameweek": 3,
  "starting_xi": [
    "pl_1"
  ],
  "bench": [
    "pl_2"
  ],
  "captain_uid": "pl_1",
  "vice_captain_uid": "pl_3",
  "active_chip": null,
  "observed_at": "2026-07-21T12:00:00Z",
  "available_at": "2026-07-21T12:00:00Z",
  "provenance": {
    "source_ids": [
      "fpl-official-endpoints"
    ],
    "transformation_version": "0.1.0",
    "ruleset_id": "2026-27-v0.1"
  }
}
